root@comp3134-Winter2026:~# tcpdump -n -i eth0
tcpdump: verbose output suppressed, use -v[v]... for full protocol decode
listening on eth0, link-type EN10MB (Ethernet), snapshot length 262144 bytes
03:58:22.458524 IP 165.227.45.66.22 > 70.51.215.139.60964: Flags [P.], seq 2617425315:2617425423, ack 1573760314, win 581, length 108
03:58:22.458636 IP 165.227.45.66.22 > 70.51.215.139.60964: Flags [P.], seq 108:196, ack 1, win 581, length 88
03:58:22.458653 IP 165.227.45.66.22 > 70.51.215.139.60964: Flags [P.], seq 196:264, ack 1, win 581, length 68
03:58:22.458688 IP 165.227.45.66.22 > 70.51.215.139.60964: Flags [P.], seq 264:332, ack 1, win 581, length 68
03:58:22.458726 IP 165.227.45.66.22 > 70.51.215.139.60964: Flags [P.], seq 332:368, ack 1, win 581, length 36
03:58:22.463532 IP 70.51.215.139.60964 > 165.227.45.66.22: Flags [.], ack 368, win 511, length 0
03:58:22.489036 IP 70.51.215.139.60964 > 165.227.45.66.22: Flags [P.], seq 1:37, ack 368, win 511, length 36
03:58:22.489253 IP 165.227.45.66.22 > 70.51.215.139.60964: Flags [P.], seq 368:404, ack 37, win 581, length 36
03:58:22.535143 IP 70.51.215.139.60964 > 165.227.45.66.22: Flags [.], ack 404, win 511, length 0
03:58:22.535143 IP 70.51.215.139.60964 > 165.227.45.66.22: Flags [P.], seq 37:73, ack 404, win 511, length 36
03:58:22.535364 IP 165.227.45.66.22 > 70.51.215.139.60964: Flags [P.], seq 404:440, ack 73, win 581, length 36
03:58:22.561527 IP 165.227.45.66.22 > 70.51.215.139.60964: Flags [P.], seq 440:612, ack 73, win 581, length 172
03:58:22.561837 IP 165.227.45.66.22 > 70.51.215.139.60964: Flags [P.], seq 612:1736, ack 73, win 581, length 1124
03:58:22.566279 IP 70.51.215.139.60964 > 165.227.45.66.22: Flags [.], ack 1736, win 506, length 0
03:58:22.567592 IP 70.51.215.139.60964 > 165.227.45.66.22: Flags [P.], seq 73:109, ack 1736, win 506, length 36
03:58:22.567860 IP 165.227.45.66.22 > 70.51.215.139.60964: Flags [P.], seq 1736:1772, ack 109, win 581, length 36
03:58:22.598893 IP 70.51.215.139.60964 > 165.227.45.66.22: Flags [P.], seq 109:145, ack 1772, win 506, length 36
03:58:22.599115 IP 165.227.45.66.22 > 70.51.215.139.60964: Flags [P.], seq 1772:1808, ack 145, win 581, length 36
03:58:22.629253 IP 70.51.215.139.60964 > 165.227.45.66.22: Flags [P.], seq 145:181, ack 1808, win 506, length 36
03:58:22.629461 IP 165.227.45.66.22 > 70.51.215.139.60964: Flags [P.], seq 1808:1844, ack 181, win 581, length 36
03:58:22.660857 IP 70.51.215.139.60964 > 165.227.45.66.22: Flags [P.], seq 181:217, ack 1844, win 511, length 36
03:58:22.661061 IP 165.227.45.66.22 > 70.51.215.139.60964: Flags [P.], seq 1844:1880, ack 217, win 581, length 36
03:58:22.665390 IP 165.227.45.66.22 > 70.51.215.139.60964: Flags [P.], seq 1880:3156, ack 217, win 581, length 1276
03:58:22.670493 IP 70.51.215.139.60964 > 165.227.45.66.22: Flags [.], ack 3156, win 506, length 0
03:58:22.691639 IP 70.51.215.139.60964 > 165.227.45.66.22: Flags [P.], seq 217:253, ack 3156, win 506, length 36
03:58:22.691896 IP 165.227.45.66.22 > 70.51.215.139.60964: Flags [P.], seq 3156:3192, ack 253, win 581, length 36
03:58:22.721412 IP 70.51.215.139.60964 > 165.227.45.66.22: Flags [P.], seq 253:289, ack 3192, win 506, length 36
03:58:22.721624 IP 165.227.45.66.22 > 70.51.215.139.60964: Flags [P.], seq 3192:3228, ack 289, win 581, length 36
03:58:22.752459 IP 70.51.215.139.60964 > 165.227.45.66.22: Flags [P.], seq 289:325, ack 3228, win 506, length 36
03:58:22.752647 IP 165.227.45.66.22 > 70.51.215.139.60964: Flags [P.], seq 3228:3264, ack 325, win 581, length 36
03:58:22.769291 IP 165.227.45.66.22 > 70.51.215.139.60964: Flags [P.], seq 3264:3420, ack 325, win 581, length 156
03:58:22.769467 IP 165.227.45.66.22 > 70.51.215.139.60964: Flags [P.], seq 3420:4240, ack 325, win 581, length 820
03:58:22.774124 IP 70.51.215.139.60964 > 165.227.45.66.22: Flags [.], ack 4240, win 511, length 0
03:58:22.774124 IP 70.51.215.139.60964 > 165.227.45.66.22: Flags [P.], seq 325:361, ack 4240, win 511, length 36
03:58:22.774321 IP 165.227.45.66.22 > 70.51.215.139.60964: Flags [P.], seq 4240:4276, ack 361, win 581, length 36
03:58:22.798477 IP 70.51.215.139.60964 > 165.227.45.66.22: Flags [P.], seq 361:397, ack 4276, win 511, length 36
03:58:22.798672 IP 165.227.45.66.22 > 70.51.215.139.60964: Flags [P.], seq 4276:4312, ack 397, win 581, length 36
03:58:22.829036 IP 70.51.215.139.60964 > 165.227.45.66.22: Flags [P.], seq 397:433, ack 4312, win 511, length 36
03:58:22.829265 IP 165.227.45.66.22 > 70.51.215.139.60964: Flags [P.], seq 4312:4348, ack 433, win 581, length 36
03:58:22.860210 IP 70.51.215.139.60964 > 165.227.45.66.22: Flags [P.], seq 433:469, ack 4348, win 511, length 36
03:58:22.860379 IP 165.227.45.66.22 > 70.51.215.139.60964: Flags [P.], seq 4348:4384, ack 469, win 581, length 36
^C
41 packets captured
50 packets received by filter
0 packets dropped by kernel
root@comp3134-Winter2026:~#